{
    "id": "B8C7DDE3-ACA0-4D27-B1EF-259806BC31B6",
    "name": "MavenCC",
    "friendlyName": "Maven With CodeCoverage",
    "description": "Build with Apache Maven and check CodeCoverage",
    "helpMarkDown": "[More Information](http://go.microsoft.com/fwlink/?LinkID=624541)",
    "category": "Build",
    "visibility": [
                "Preview",
                "Build"
                  ],    
    "author": "Microsoft Corporation",
    "version": {
        "Major": 1,
        "Minor": 0,
        "Patch": 1
    },
    "demands" : [
        "maven"
    ],
    "minimumAgentVersion": "1.88.0",
    "instanceNameFormat": "MavenCC $(mavenPOMFile)",
    "groups": [
        {
            "name":"junitTestResults",
            "displayName":"JUnit Test Results",
            "isExpanded":true
        },
        {
            "name": "codeCoverage",
            "displayName": "Code Coverage",
            "isExpanded": true
        },
        {
            "name":"advanced",
            "displayName":"Advanced",
            "isExpanded":false
        }
    ],
    "inputs": [
        { 
            "name": "mavenPOMFile", 
            "type": "filePath", 
            "label": "Maven POM file", 
            "defaultValue": "", 
            "required": true,
            "helpMarkDown": "Relative path from the repo root to the `Maven POM file`."
        },
        { 
            "name": "options", 
            "type": "string", 
            "label": "Options", 
            "defaultValue": "", 
            "required": false,
            "helpMarkDown": "Specify any commandline options to be passed to Maven."
        },
        { 
            "name": "goals",
            "type": "string", 
            "label": "Goal(s)", 
            "defaultValue": "package", 
            "required": false,
            "helpMarkDown": "Specify the name of the goal to be invoked by Maven."
        },        
        {
            "name":"publishJUnitResults",
            "type":"boolean",
            "label":"Publish to VSO/TFS",
            "required":true,
            "defaultValue":"true",
            "groupName":"junitTestResults",
            "helpMarkDown":"Select this option to publish JUnit Test results produced by the Maven build to VSO/TFS. Each test result file matching `Test Results Files` will be published as a test run in VSO/TFS."
        }, 
        {
            "name": "testResultsFiles",
            "type": "filePath",
            "label": "Test Results Files",
            "defaultValue": "**/TEST-*.xml",
            "required": true,
            "groupName":"junitTestResults",
            "helpMarkDown": "Test results files path.  Wildcards can be used.  For example, `**/TEST-*.xml` for all xml files whose name starts with TEST-."
        },
        {
            "name": "codeCoverageTool",
            "type": "pickList",
            "label": "CodeCoverage Tool",
            "required": false,
            "groupName": "codeCoverage",
            "defaultValue": "None",
            "helpMarkDown": "Select the code coverage tool.",
            "options": {
                "NoCoverage": "None",
                "JaCoCo": "JaCoCo"
            }
        },
        {
            "name": "classFilter",
            "type": "string",
            "label": "Class Inclusion/Exclusion Filters",
            "defaultValue": "",
            "required": false,
            "groupName": "codeCoverage",
            "helpMarkDown": "Comma separated list of filters to include or exclude classes from collecting code coverage. For example, +:com.*,+:org.*,-:my.app*.*. Refer http://www.eclemma.org/jacoco/trunk/doc/maven.html.",
            "visibleRule": "codeCoverageTool = JaCoCo"
        },
        {
            "name":"jdkVersion",
            "type":"pickList",
            "label":"JDK Version",
            "required":false,
            "groupName":"advanced",
            "defaultValue":"default",
            "helpMarkDown": "Will attempt to discover the path to the selected JDK version and set JAVA_HOME accordingly.",
            "options": {
                "default":"default",
                "1.8":"JDK 8",
                "1.7":"JDK 7",
                "1.6":"JDK 6"
            }
        },
        { 
            "name": "jdkArchitecture", 
            "type": "pickList", 
            "label": "JDK Architecture", 
            "defaultValue":"x86", 
            "required":false,
            "helpMarkDown": "Optionally supply the architecture (x86, x64) of JDK.",
            "groupName":"advanced",
            "options":{
                "x86":"x86",
                "x64":"x64"
            }
        }
    ],
    "execution": {
        "Node": {
            "target": "maven2.js",
            "argumentFormat": ""
        },
        "PowerShell": {
            "target": "$(currentDirectory)\\maven.ps1",
            "argumentFormat": "",
            "workingDirectory": "$(currentDirectory)"
        }
    }
}