{
    "id": "67cec91b-0351-4c2f-8465-d74b3d2a2d96",
    "name": "CopyFilesOverSSH",
    "friendlyName": "Copy Files Over SSH",
    "description": "Copy files or build artifacts to a remote machine over SSH",
    "helpMarkDown": "[More Information](https://go.microsoft.com/fwlink/?LinkId=821894)",
    "category": "Deploy",
    "visibility": [
        "Build",
        "Release"
    ],
	"runsOn": [
        "Agent",
        "MachineGroup"
    ],
    "author": "Microsoft Corporation",
    "version": {
        "Major": 0,
        "Minor": 1,
        "Patch": 2
    },
    "demands": [],
    "instanceNameFormat": "Securely copy files to the remote machine",
    "groups": [
        {
            "name": "advanced",
            "displayName": "Advanced",
            "isExpanded": false
        }
    ],
    "inputs": [
        {
            "name": "sshEndpoint",
            "type": "connectedService:ssh",
            "label": "SSH endpoint",
            "defaultValue": "",
            "required": true,
            "helpMarkDown": "SSH endpoint with connection details for the remote machine."
        },
        {
            "name": "sourceFolder",
            "type": "filePath",
            "label": "Source folder",
            "defaultValue": "",
            "required": false,
            "helpMarkDown": "The source folder for the files to copy to the remote machine.  Empty is the root of the repo.  Use [variables](https://go.microsoft.com/fwlink/?LinkID=550988) if files are not in the repo. Example: $(agent.builddirectory)"
        },
        {
            "name": "contents",
            "type": "multiLine",
            "label": "Contents",
            "defaultValue": "**",
            "required": true,
            "helpMarkDown": "File paths to include as part of the copy. Supports multiple lines of minimatch patterns. [More Information](https://go.microsoft.com/fwlink/?LinkId=821894)"
        },
        {
            "name": "targetFolder",
            "type": "string",
            "label": "Target folder",
            "defaultValue": "",
            "required": true,
            "helpMarkDown": "Target folder on the remote machine to where files will be copied. Example: /home/user/MySite."
        },
        {
            "name": "cleanTargetFolder",
            "type": "boolean",
            "label": "Clean target folder",
            "defaultValue": "false",
            "required": false,
            "helpMarkDown": "Delete all existing files in the target folder before copying.",
            "groupName": "advanced"
        },
        {
            "name": "overwrite",
            "type": "boolean",
            "label": "Overwrite",
            "defaultValue": "true",
            "required": false,
            "helpMarkDown": "Replace existing files in the target folder.",
            "groupName": "advanced"
        },
        {
            "name": "flattenFolders",
            "type": "boolean",
            "label": "Flatten folders",
            "defaultValue": "false",
            "required": false,
            "helpMarkDown": "Flatten the folder structure and copy all files into the specified target folder on the remote machine.",
            "groupName": "advanced"
        }
    ],
    "execution": {
        "Node": {
            "target": "copyfilesoverssh.js",
            "argumentFormat": ""
        }
    },
    "messages": {
        "UseDefaultPort": "Using port 22 which is the default for SSH since no port was specified.",
        "SourceNotFolder": "Source folder has to be a valid folder path.",
        "CleanTargetFolder": "Cleaning target folder %s on the remote machine",
        "CleanTargetFolderFailed": "Failed to clean the target folder on the remote machine. %s",
        "NothingToCopy": "No files were found matching the patterns specified to copy to the remote machine.",
        "CopyingFiles": "Found %s files to copy to the remote machine.",
        "StartedFileCopy": "Copying file %s to %s on remote machine.",
        "CopyCompleted": "Completed copying %s files to the remote machine.",
        "FileExists": "File %s cannot be copied to the remote machine because it already exists and the 'Overwrite' option is disabled.",
        "SettingUpSSHConnection": "Setting up SSH connection to remote host %s.",
        "ConnectionNotSetup": "SSH connection is not set up.",
        "ConnectionFailed": "Failed to connect to remote machine. Verify the SSH endpoint details. %s.",
        "RemoteCmdExecutionErr": "Command %s failed with errors on remote machine. %s.",
        "CheckLogForStdErr": "Check the build log for STDERR from the command.",
        "RemoteCmdNonZeroExitCode": "Command %s exited with code %s.",
        "UploadFileFailed": "Failed to upload %s to %s on remote machine. %s."
    }
}