{
    "id": "BCB64569-D51A-4AF0-9C01-EA5D05B3B622",
    "name": "ManualIntervention",
    "friendlyName": "Manual Intervention",
    "description": "Pause deployment and wait for intervention",
    "helpMarkDown": "[More Information](http://go.microsoft.com/fwlink/?LinkID=825235)",
    "category": "Deploy",
    "visibility": [
        "Release"
    ],
    "author": "Microsoft Corporation",
    "runsOn": [
        "Server"
    ],
    "version": {
        "Major": 8,
        "Minor": 0,
        "Patch": 3
    },
    "inputs": [
        {
            "name": "instructions",
            "type": "multiLine",
            "label": "Instructions",
            "defaultValue": "",
            "required": false,
            "helpMarkDown": "These instructions will be shown to the user for resuming or rejecting the manual intervention. Based on these instructions the user will take an informed decision about this manual intervention.",
            "properties": {
                "resizable": "true",
                "rows": "10",
                "maxLength": "500"
            }
        },
		{
            "name": "SendEmailNotification",
            "type": "boolean",
            "label": "Send email notification",
            "defaultValue": "false",
            "required": false,
            "helpMarkDown": "Send a manual intervention pending email to all users who have Manage deployment permission. Only users with Manage deployment permission can act on a manual intervention."
			}
    ],
    "instanceNameFormat": "Manual Intervention",
    "execution": {
        "RM:ManualIntervention": {}
    }
}