{
    "id": "B82CFBE4-34F9-40F5-889E-C8842CA9DD9D",
    "name": "Gulp",
    "friendlyName": "Gulp",
    "description": "Build with a Node.js streaming, task-based build system",
    "category": "Build",
    "visibility": [
                "Build"
                  ],    
    "author": "Microsoft Corporation",
    "version": {
        "Major": 0,
        "Minor": 1,
        "Patch": 2
    },
    "demands" : [
        "gulp"
    ],
    "groups": [
        {
            "name":"advanced",
            "displayName":"Advanced",
            "isExpanded":false
        }
    ],    
    "instanceNameFormat": "gulp $(tasks)",
    "inputs": [
        { 
            "name": "gulpFile",
            "type": "filePath",
            "label": "Gulp File Path",
            "defaultValue":"gulpfile.js",
            "required":true,
            "helpMarkDown": "Relative path from repo root of the gulp file script file to run."
        },
        {
            "name": "targets",
            "type": "string",
            "label": "Gulp Task(s)",
            "defaultValue":"",
            "helpMarkDown": "Optional.  default task will get run if not specified. Space delimited list of tasks to run.  If not specified, the default task will run.",
            "required":false
        },
        {
            "name": "arguments",
            "type": "string",
            "label": "Arguments",
            "defaultValue":"",
            "helpMarkDown": "Additional arguments passed to gulp.  --gulpfile is not needed since already added via gulpFile input above.",
            "required":false,
            "groupName":"advanced"
        },
        {
            "name": "cwd",
            "type": "filePath",
            "label": "Working Directory",
            "defaultValue":"",
            "required":false,
            "helpMarkDown": "Current working directory when script is run.  Defaults to the folder where the script is located.",
            "groupName":"advanced"
        }
    ],
    "execution": {
        "Node": {
            "target": "gulptask.js",
            "argumentFormat": ""
        }
    }
}