{
    "id": "DF857559-8715-46EB-A74E-AC98B9178AA0",
    "name": "AndroidBuild",
    "friendlyName": "Android Build",
    "description": "Build an Android app using Gradle and optionally start the emulator for unit tests",
    "category": "Build",
    "visibility": [
                "Build"
                  ],   
    "author": "Microsoft Corporation",
    "version": {
        "Major": 1,
        "Minor": 0,
        "Patch": 2
    },
    "demands" : [
	    "AndroidSDK"
    ],
    "groups":  [
        {
            "name": "emulatorOptions", 
            "displayName":"Emulator Options",
            "isExpanded":true
        }
    ],
    "inputs": [
        { 
            "name": "gradleWrapper", 
            "type": "filePath", 
            "label": "Location of Gradle Wrapper", 
            "defaultValue":"", 
            "required":false
        },
        { 
            "name": "gradleProj", 
            "type": "filePath",
            "label": "Project Directory", 
            "defaultValue":"", 
            "required":false 
        },
        { 
            "name": "gradleArguments", 
            "type": "string", 
            "label": "Arguments", 
            "defaultValue":"", 
            "required":false
        },
        { 
            "name": "startEmulator", 
            "type": "boolean", 
            "label": "Start Android Emulator", 
            "defaultValue":"False", 
            "required":false,
            "groupName":"emulatorOptions" 
        },
        { 
            "name": "emulatorTarget", 
            "type": "string", 
            "label": "Emulator Target SDK", 
            "defaultValue":"android-19", 
            "required":false, 
            "visibleRule": "startEmulator = true", 
            "groupName":"emulatorOptions" 
        },
        { 
            "name": "emulatorDevice", 
            "type": "string", 
            "label": "Emulator Device", 
            "defaultValue":"Nexus 5", 
            "required":false,
            "visibleRule": "startEmulator = true", 
            "groupName":"emulatorOptions" 
        }
    ],
    "instanceNameFormat": "Android Build $(gradleProj)",
    "execution": {
        "PowerShell": {
            "target": "$(currentDirectory)\\AndroidBuild.ps1",
            "argumentFormat": "",
            "workingDirectory": "$(currentDirectory)"
        }
    }
}
