{
    "id": "333b11bd-d341-40d9-afcf-b32d5ce6f24b",
    "name": "NuGetPackager",
    "friendlyName": "NuGet Packager",
    "description": "Creates nupkg outputs from csproj or nuspec files",
    "helpMarkDown": "[More Information](http://go.microsoft.com/fwlink/?LinkID=627416)",
    "category": "Package",
    "author": "Lawrence Gripper",
    "version": {
        "Major": 0,
        "Minor": 1,
        "Patch": 62
    },
    "minimumAgentVersion": "1.83.0",
    "groups": [
        {
            "name":"versioning",
            "displayName":"Versioning",
            "isExpanded":true
        },
        {
            "name":"advanced",
            "displayName":"Advanced",
            "isExpanded":false
        }
    ],    
    "instanceNameFormat": "NuGet Packager $(solution)",
    "inputs": [
        {
            "name": "searchPattern",
            "type": "filePath",
            "label": "Path/Pattern to nuspec files",
            "defaultValue":"**\\*.nuspec",
            "helpMarkDown": "Pattern to search for nuspec and csproj files to pack.",
            "required":true
        },
        {
            "name": "outputdir",
            "type": "filePath",
            "label": "Package Folder",
            "defaultValue":"",
            "helpMarkDown": "Folder where packages will be created, if empty will be created in the directory of csproj or nuspec file",
            "required":false
        },
        {
            "name": "versionByBuild",
            "type": "pickList",
            "label": "Automatic package versioning",
            "defaultValue":"false",
            "helpMarkDown": "If you choose 'Generate a prerelease string', this will generate a SemVer-compliant version formatted as `X.Y.Z-ci-datetime` where you choose X, Y, and Z.\n\nIf you choose 'From an environment variable', you must select an environment variable and ensure it contains the version number you want to use.\n\nIf you choose 'By build number', this will use the build number to version you package. **Note:** Under General set the build format to be '$(BuildDefinitionName)_$(Year:yyyy).$(Month).$(DayOfMonth)$(Rev:.r)'.",
            "required":true,
            "groupName": "versioning",
            "options": {
                "false": "Off",
                "byPrereleaseNumber": "Generate a prerelease string",
                "byEnvVar": "From an environment variable",
                "true": "By build number"
            }
        },
        {
            "name": "versionEnvVar",
            "type": "string",
            "label": "Environment variable",
            "defaultValue":"",
            "helpMarkDown": "Enter the variable name without $, $env, or %.",
            "required":true,
            "groupName": "versioning",
            "visibleRule": "versionByBuild = byEnvVar"
        },
        {
            "name": "requestedMajorVersion",
            "type": "string",
            "label": "Major",
            "defaultValue":"1",
            "helpMarkDown": "The 'X' in version X.Y.Z",
            "required":true,
            "groupName": "versioning",
            "visibleRule": "versionByBuild = byPrereleaseNumber"
        },
        {
            "name": "requestedMinorVersion",
            "type": "string",
            "label": "Minor",
            "defaultValue":"0",
            "helpMarkDown": "The 'Y' in version X.Y.Z",
            "required":true,
            "groupName": "versioning",
            "visibleRule": "versionByBuild = byPrereleaseNumber"
        },
        {
            "name": "requestedPatchVersion",
            "type": "string",
            "label": "Patch",
            "defaultValue":"0",
            "helpMarkDown": "The 'Z' in version X.Y.Z",
            "required":true,
            "groupName": "versioning",
            "visibleRule": "versionByBuild = byPrereleaseNumber"
        },
        {
            "name": "configurationToPack",
            "type": "string",
            "label": "Configuration to Package",
            "defaultValue":"Release",
            "helpMarkDown": "When using a csproj file this specifies the configuration to package",
            "required":false,
            "groupName": "advanced"
        },
        {
            "name": "buildProperties",
            "type": "string",
            "label": "Additional build properties",
            "defaultValue": "",
            "required": false,
            "helpMarkDown": "Semicolon delimited list of properties used to build the package.",
            "groupName": "advanced"
        },
        {
            "name": "nuGetAdditionalArgs",
            "type": "string",
            "label": "NuGet Arguments",
            "defaultValue": "",
            "required": false,
            "helpMarkDown": "Additional arguments passed to NuGet.exe pack. [More Information](https://docs.nuget.org/consume/command-line-reference#user-content-pack-command).",
            "groupName": "advanced"
        },
        {
            "name": "nuGetPath",
            "type": "string",
            "label": "Path to NuGet.exe",
            "defaultValue": "",
            "required": false,
            "helpMarkDown": "Optionally supply the path to NuGet.exe",
            "groupName": "advanced"
        }

    ],
    "execution": {
        "PowerShell": {
            "target": "$(currentDirectory)\\NuGetPackager.ps1",
            "argumentFormat": "",
            "workingDirectory": ""
        }
    }
}
