{
  "id": "d8b84976-e99a-4b86-b885-4849694435b0",
  "name": "ArchiveFiles",
  "friendlyName": "ms-resource:loc.friendlyName",
  "description": "ms-resource:loc.description",
  "author": "Microsoft Corporation",
  "helpMarkDown": "ms-resource:loc.helpMarkDown",
  "category": "Utility",
  "visibility": [
    "Build",
    "Release"
  ],
  "demands": [],
  "version": {
    "Major": 1,
    "Minor": 0,
    "Patch": 2
  },
  "groups": [
    {
      "name": "archive",
      "displayName": "ms-resource:loc.group.displayName.archive",
      "isExpanded": true
    }
  ],
  "instanceNameFormat": "ms-resource:loc.instanceNameFormat",
  "inputs": [
    {
      "name": "rootFolder",
      "type": "filePath",
      "label": "ms-resource:loc.input.label.rootFolder",
      "defaultValue": "$(Build.BinariesDirectory)",
      "required": true,
      "helpMarkDown": "ms-resource:loc.input.help.rootFolder"
    },
    {
      "name": "includeRootFolder",
      "type": "boolean",
      "label": "ms-resource:loc.input.label.includeRootFolder",
      "defaultValue": true,
      "required": true,
      "helpMarkDown": "ms-resource:loc.input.help.includeRootFolder"
    },
    {
      "name": "archiveType",
      "type": "pickList",
      "label": "ms-resource:loc.input.label.archiveType",
      "required": true,
      "defaultValue": "default",
      "helpMarkDown": "ms-resource:loc.input.help.archiveType",
      "groupName": "archive",
      "options": {
        "default": "zip",
        "7z": "7z",
        "tar": "tar",
        "wim": "wim"
      }
    },
    {
      "name": "tarCompression",
      "type": "pickList",
      "label": "ms-resource:loc.input.label.tarCompression",
      "required": false,
      "defaultValue": "gz",
      "helpMarkDown": "ms-resource:loc.input.help.tarCompression",
      "groupName": "archive",
      "visibleRule": "archiveType = tar",
      "options": {
        "default": "gz",
        "bz2": "bz2",
        "xz": "xz",
        "none": "None"
      }
    },
    {
      "name": "archiveFile",
      "type": "filePath",
      "label": "ms-resource:loc.input.label.archiveFile",
      "defaultValue": "$(Build.ArtifactStagingDirectory)/$(Build.BuildId).zip",
      "required": true,
      "helpMarkDown": "ms-resource:loc.input.help.archiveFile",
      "groupName": "archive"
    },
    {
      "name": "replaceExistingArchive",
      "type": "boolean",
      "label": "ms-resource:loc.input.label.replaceExistingArchive",
      "required": true,
      "defaultValue": "true",
      "helpMarkDown": "ms-resource:loc.input.help.replaceExistingArchive",
      "groupName": "archive"
    }
  ],
  "execution": {
    "Node": {
      "target": "archivefiles.js",
      "argumentFormat": ""
    }
  }
}