{
  "id": "BCB64569-D51A-4AF0-9C01-EA5D05B3B622",
  "name": "ManualIntervention",
  "friendlyName": "ms-resource:loc.friendlyName",
  "description": "ms-resource:loc.description",
  "helpMarkDown": "ms-resource:loc.helpMarkDown",
  "category": "Deploy",
  "visibility": [
    "Release"
  ],
  "author": "Microsoft Corporation",
  "runsOn": [
    "Server"
  ],
  "version": {
    "Major": 8,
    "Minor": 0,
    "Patch": 0
  },
  "inputs": [
    {
      "name": "instructions",
      "type": "multiLine",
      "label": "ms-resource:loc.input.label.instructions",
      "defaultValue": "",
      "required": false,
      "helpMarkDown": "ms-resource:loc.input.help.instructions",
      "properties": {
        "resizable": "true",
        "rows": "10",
        "maxLength": "500"
      }
    }
  ],
  "instanceNameFormat": "ms-resource:loc.instanceNameFormat",
  "execution": {
    "RM:ManualIntervention": {}
  }
}
